{"bundle_id":"bnd_unicode","bundle_kind":"imported_memory","claims":[{"approval_eligible":false,"claim_id":"clm_target","claim_type":"fact","key":"deployment.target","source_refs":["src_target"],"value":"café"}],"schema_version":"0.1.0","scope":"repo:synthetic-example","sources":[{"bytes":45,"media_type":"text/plain","path":"sources/target.txt","sha256":"56dea8030470c4000e35dfb8bf2853588e574e6553b2e527a7bd8e7ed72cd1fe","source_id":"src_target"}],"supersessions":[]}
