{"bundle_id":"bnd_resolved_conflict","bundle_kind":"imported_memory","claims":[{"approval_eligible":false,"claim_id":"clm_region_a","claim_type":"fact","key":"service.region","source_refs":["src_region_a"],"value":"east"},{"approval_eligible":false,"claim_id":"clm_region_b","claim_type":"fact","key":"service.region","source_refs":["src_region_b"],"value":"west"},{"approval_eligible":false,"claim_id":"clm_region_final","claim_type":"fact","key":"service.region","source_refs":["src_region_final"],"value":"central"}],"schema_version":"0.1.0","scope":"repo:synthetic-example","sources":[{"bytes":27,"media_type":"text/plain","path":"sources/region-a.txt","sha256":"8879c7ce3c77610f1f3cfb24db2789f6547398a1ff11d9379fbbfcf49800c463","source_id":"src_region_a"},{"bytes":27,"media_type":"text/plain","path":"sources/region-b.txt","sha256":"73449dc616fb16cc35da5a4b6a47f3a8b76210b8f8ce817289664532ed3f2f93","source_id":"src_region_b"},{"bytes":42,"media_type":"text/plain","path":"sources/region-final.txt","sha256":"67f2371d2c1dc4855ed1a91a397ee1d290a791756d5a0dd07f479a5b4dd95a39","source_id":"src_region_final"}],"supersessions":[{"edge_id":"sup_region_a","reason":"Signed decision supersedes draft A.","superseded_claim_id":"clm_region_a","superseding_claim_id":"clm_region_final"},{"edge_id":"sup_region_b","reason":"Signed decision supersedes draft B.","superseded_claim_id":"clm_region_b","superseding_claim_id":"clm_region_final"}]}
