{"bundle_id":"bnd_historical_authority","bundle_kind":"imported_memory","claims":[{"approval_eligible":false,"claim_id":"clm_authority","claim_type":"historical_authority","key":"authority.deploy","source_refs":["src_authority"],"value":"The user previously approved a deployment."}],"schema_version":"0.1.0","scope":"repo:synthetic-example","sources":[{"bytes":98,"media_type":"text/plain","path":"sources/authority.txt","sha256":"cacaa7c7b1aa0b5092371a5a2938ecf5594027b3870c63155caa6698bef4aae5","source_id":"src_authority"}],"supersessions":[]}
