{"bundle_id":"bnd_multi_source","bundle_kind":"imported_memory","claims":[{"approval_eligible":false,"claim_id":"clm_reviewed_target","claim_type":"fact","key":"deployment.reviewed_target","source_refs":["src_policy","src_decision"],"value":"staging under the production-change review policy"}],"schema_version":"0.1.0","scope":"repo:synthetic-example","sources":[{"bytes":45,"media_type":"text/plain","path":"sources/policy.txt","sha256":"f9037bd9c620a766aa8562d7e497607478a722f30283a24015c6ee4a764f893d","source_id":"src_policy"},{"bytes":41,"media_type":"text/plain","path":"sources/decision.txt","sha256":"e8d5aeb3d2e6166c44b83f35bf6699d780364f80efb0c6d443179b6d0fe5f0f4","source_id":"src_decision"}],"supersessions":[]}
