{"bundle_id":"bnd_supersession_chain","bundle_kind":"imported_memory","claims":[{"approval_eligible":false,"claim_id":"clm_target_old","claim_type":"fact","key":"deployment.target","source_refs":["src_target_old"],"value":"staging"},{"approval_eligible":false,"claim_id":"clm_target_new","claim_type":"fact","key":"deployment.target","source_refs":["src_target_new"],"value":"production"}],"schema_version":"0.1.0","scope":"repo:synthetic-example","sources":[{"bytes":45,"media_type":"text/plain","path":"sources/target-old.txt","sha256":"56dea8030470c4000e35dfb8bf2853588e574e6553b2e527a7bd8e7ed72cd1fe","source_id":"src_target_old"},{"bytes":48,"media_type":"text/plain","path":"sources/target-new.txt","sha256":"6c35bce27bb36882be459c3a5dc7d94f6d6c0aa6ee8d204e51fa3aa2a79a4ec4","source_id":"src_target_new"}],"supersessions":[{"edge_id":"sup_target","reason":"A later decision changed the target.","superseded_claim_id":"clm_target_old","superseding_claim_id":"clm_target_new"}]}
